{
  "$schema": "https://json-schema.org/draft/2020-12/schema",
  "$id": "https://jlaudio.github.io/jl-mixing/api/v1.0/schemas/operations/intake-validate.schema.json",
  "type": "object",
  "additionalProperties": true,
  "required": ["api_version", "operation", "status", "data", "warnings", "errors"],
  "properties": {
    "api_version": {"const": "1.0"},
    "operation": {"const": "intake.validate"},
    "status": {"enum": ["success", "planned", "blocked", "error"]},
    "data": {
      "type": "object",
      "additionalProperties": true,
      "properties": {
        "project": {
          "type": "object",
          "required": ["id", "path"],
          "properties": {
            "id": {"type": "string"},
            "path": {"type": "string", "minLength": 1}
          }
        },
        "manifest_path": {"type": "string", "minLength": 1},
        "intake_report_path": {"type": "string", "minLength": 1},
        "validation_cache_path": {"type": "string", "minLength": 1},
        "workspace_path": {"type": "string", "minLength": 1},
        "source_path": {"type": "string", "minLength": 1},
        "summary": {
          "type": "object",
          "required": ["files_discovered", "blocking_errors", "warnings", "ffprobe_available"],
          "properties": {
            "files_discovered": {"type": "integer", "minimum": 0},
            "blocking_errors": {"type": "integer", "minimum": 0},
            "warnings": {"type": "integer", "minimum": 0},
            "ffprobe_available": {"type": ["boolean", "null"]},
            "ffmpeg_available": {"type": ["boolean", "null"]},
            "cache_reused": {"type": "integer", "minimum": 0},
            "files_validated": {"type": "integer", "minimum": 0}
          }
        },
        "files": {
          "type": "array",
          "items": {"$ref": "#/$defs/validationFile"}
        },
        "audio_prep": {
          "type": "object",
          "required": ["working_path", "validation_cache_path", "summary", "files"],
          "properties": {
            "working_path": {"type": "string", "minLength": 1},
            "validation_cache_path": {"type": "string", "minLength": 1},
            "summary": {
              "type": "object",
              "required": ["files_discovered", "blocking_errors", "warnings", "ffprobe_available", "ffmpeg_available", "cache_reused", "files_validated"],
              "properties": {
                "files_discovered": {"type": "integer", "minimum": 0},
                "blocking_errors": {"type": "integer", "minimum": 0},
                "warnings": {"type": "integer", "minimum": 0},
                "ffprobe_available": {"type": ["boolean", "null"]},
                "ffmpeg_available": {"type": ["boolean", "null"]},
                "cache_reused": {"type": "integer", "minimum": 0},
                "files_validated": {"type": "integer", "minimum": 0}
              }
            },
            "files": {
              "type": "array",
              "items": {
                "allOf": [
                  {"$ref": "#/$defs/validationFile"},
                  {
                    "type": "object",
                    "required": ["original_delivery_relative_path", "original_filename", "provenance_state"],
                    "properties": {
                      "original_delivery_relative_path": {"type": ["string", "null"]},
                      "original_filename": {"type": ["string", "null"]},
                      "provenance_state": {"enum": ["exact_content", "ambiguous", "unavailable"]}
                    }
                  }
                ]
              }
            }
          }
        },
        "would_update": {"type": "array", "items": {"type": "string", "minLength": 1}}
      }
    },
    "warnings": {"type": "array"},
    "errors": {"type": "array"}
  },
  "$defs": {
    "validationFile": {
      "type": "object",
      "additionalProperties": true,
      "required": ["relative_path", "is_audio", "status", "cache_state", "findings"],
      "properties": {
        "relative_path": {"type": "string", "minLength": 1},
        "is_audio": {"type": "boolean"},
        "status": {"enum": ["valid", "needs_attention", "blocked", "info", "not_applicable"]},
        "cache_state": {"enum": ["validated", "reused"]},
        "sha256": {"type": ["string", "null"]},
        "metadata": {"type": ["object", "null"]},
        "decode_ok": {"type": ["boolean", "null"]},
        "dual_mono": {"type": ["boolean", "null"]},
        "findings": {
          "type": "array",
          "items": {
            "type": "object",
            "required": ["code", "severity", "message"],
            "properties": {
              "code": {"type": "string", "minLength": 1},
              "severity": {"enum": ["critical", "warning", "info"]},
              "message": {"type": "string", "minLength": 1},
              "expected": {},
              "actual": {},
              "related_paths": {"type": "array", "items": {"type": "string", "minLength": 1}}
            }
          }
        }
      }
    }
  }
}
